,review,rating
1235,"More questions than answers, don't take this too seriously",4
1236,"ignore the critics, this movie had me on the edge of my seat! :)",8
1237,It was...... OK,6
1238,Meh...,3
1239,An unusual depiction of Justice from the opposite site,8
1240,See it if you are a DC fan,6
1241,Somewhere between fine and failure,4
1242,An interesting Episode,7
1243,Major Disappointment,1
1244,They are the bad guys but that's not what they do! Still...a fun ride!,6
1245,"Dark, gory and sexually explicit.",1
1246,A Welcomed Addition to the DC Universe,8
1247,Wasted Potential,6
1248,"Muddled plot, muddled acting, muddled editing.",2
1249,Solid 8/10. Don't let bad reviews spoil it for you.,8
1250,Much potential but so wrongly executed,4
1251,Hyped? yes. As bad as everybody says? not really.,6
1252,a waste of time,3
1253,Could've been much better...,6
1254,very very bad movie ( Spoiler Alert),1
1255,Action pack,8
1256,It's just about worth the 2 hours of my time,6
1257,And they said Suicide is Painless!,4
1258,DC SUICIDE SQUAD MOVIE 1016,10
1259,Suicide Squad had Potential,6
1260,Cinematic candy,5
1261,It was good but poor work from David Ayer,6
1262,What a disgrace,1
1263,I actually kinda liked it,7
1264,"Small good things, but as whole bad",4
1265,What a great popcorn flick!,9
1266,Suicide Squad Review,6
1267,Such a freaking pandering cringefest,1
1268,DC / Warner v Critics impartial,10
1269,Borderline fun. With too much burdens of expectations for it to bear alone.,6
1270,"A laughing matter it is not. Suicide Squad has some colorful baddies, but gives little for them to do",5
1271,The bad people,7
1272,Is what you've heard true? 50/50. But which half?,5
1273,"Not bad, but could have been better",6
1274,Disturbingly pathetic,1
1275,I absolutely f****** love this movie man!,9
1276,entertaining enough,6
1277,An Incompetent Mess,2
1278,I actually enjoyed this movie,10
1279,Expected better but quite entertaining! 6/10,6
1280,Tries to hard and delivers a bland uninteresting story,1
1281,David Ayer's Writing and Direction- a complete letdown. The Suicide Squad themselves will keep you engaged throughout.,6
1282,All that hype for such little delivery,2
1283,Weird and confusing but good enough,7
1284,Should have been better.,5
1285,#ReleaseTheAyerCut,10
1286,Good movie with poor presentation,6
1287,Rushed and Underdeveloped,3
1288,A very good watch,10
1289,Could have been better,6
1290,This movie is such a mess...,3
1291,Third Trial Trying To Get Things Straight,6
1292,Disappointing at best,4
1293,Colorful empty,6
1294,No heart & soul. Just panicky bigshots.,1
1295,Love this movie,10
1296,In the middle,6
1297,"Suicide Squad: Bad Guys or Nice Guys, I'm Confused?",5
1298,Message to Warner Brothers....,8
1299,Top Three Superhero Movies Of All Time,7
1300,A Disappointing Mess,3
1301,Suicide Squad,7
1302,don't waste your money,5
1303,Entertaining enough,7
1304,"Can I get those two hours of my life back, please?",2
1305,Enjoyed it! Great scenes but... cut!,10
1306,UM....OK?,7
1307,Rest in Peace DCU,2
1308,they never cared about the hate,10
1309,"Harley, Deadshot, & Viola Davis Keep It from Sucking",7
1310,Terrific start but slowly turned into a bland and terrible movie,5
1311,"Based on what Dc gave us this year, it was pretty good",7
1312,The movie is ridiculous,2
1313,"A good movie, so much wasted potential.",7
1314,What a waste of a good concept,3
1315,The Truth,10
1316,Jared Leto knew what he was doing as the Joker!,6
1317,Bad. Just BAD.(SPOILERS),3
1318,Best Comic Book Movie Ever!,10
1319,Rise of the good Villains,7
1320,Average Film - Silly Ratings,5
1321,For Joana,6
1322,What a mess!,5
1323,What is with bad reviews.,7
1324,not a movie,1
1325,Loved it!,10
1326,"Wrong choice of villain but a good live-action adaption, too bad we won't see Ayer's cut",6
1327,Didn't like This movie,2
1328,All the critics were WRONG!!! Great Film!!!,10
1329,A whole lot of bang with no deafening noise to cover it all up,7
1330,Meeehhhh...,5
1331,"Not Bad, Not Great, But Good Enough",7
1332,"It may not be as long as 'Batman V Superman (2016)', but it's certainly much harder to sit through.",3
1333,Fun but...,7
1334,Abysmal,2
1335,It's really not that bad,8
1336,A Bit Of A Hype,6
1337,Tries too hard to be 'Avengers (with Bad Guys)',5
1338,Master piece..,10
1339,"As entertaining as it still is, it was quite a disappointment.",6
1340,Suicidal,1
1341,Loved the joker!!,6
1342,Promosing beginning then everything fall apart,3
1343,Characters were cool........plot/story.....not so much,6
1344,Uuuuuggghhhh,1
1345,A bold decision for DC. It certainly delivered.,10
1346,Give this movie a chance people.,7
1347,If You've Watched The Trailers...,4
1348,I liked it!,10
1349,2016 was not the best year for DC in Theaters,7
1350,Ruined potential,2
1351,Amazing cast can't save this movie from horrid studio interference,6
1352,Big disappointment,1
1353,DC trying to go too fast for big team blockbusters,6
1354,Phantom Menacing Syndrome again,4
1355,Great Movie!!!!!!!,10
1356,"completely misses the point, bigger is not always better",6
1357,"Potential is Wasted by a Muddled Plot,",5
1358,Awesome ride with an excellent cast....must see!,10
1359,"Not that good , these comic book adaptions are all starting to wear thin .",6
1360,Total Disappointment,3
1361,What a waste,6
1362,I really wanted to like this movie...,3
1363,Perfect Characters In A Untidy Plot,7
1364,"I wanted to like it, but a mess of a movie is still a mess of a movie.",3
1365,If you are a DC fan you will like this movie,10
1366,Lots of Problems,7
1367,"How hard could it be to ruin a movie about super villains teaming up? Apparently, not very",3
1368,I had a smile on my face from start to finish!!,10
1369,"Not up to expectation of the incredible previews, but not anywhere as bad as some make out...",7
1370,Nearly left,4
1371,"A great movie, put poor marketing can compromise experience and quality.",7
1372,Baddies on a PG-13 Spree.,1
1373,Some Balanced Commentary,6
1374,Truly Madly Deeply Awful,1
1375,Great movie!,10
1376,Surprisingly Entertaining,7
1377,Not worth your time or your money,4
1378,I think this movie can be set to 8.5/10,9
1379,"Good as a movie, not so much as a comic adaption",6
1380,I just...don't know what to say...,2
1381,Absolute rubbish,4
1382,Jared Leto and Margot Robbie Save The Day,6
1383,DC is going the wrong way.....,4
1384,Best Cult Film in over 30 years.,10
1385,Harley Is No Barbie,7
1386,I'm Sorry But I Just Have To Write Something,1
1387,An Enjoyable Comic Book Movie,8
1388,Kind of all over the place,6
1389,Suicide Squad - Review,5
1390,1/2 of a good movie and now an extended version? No thanks!,6
1391,So much to say about this film but not at all worth the effort,1
1392,Margot Robbie Steals The Movie,7
1393,What a let down,4
1394,Damn Good Killing,8
1395,Just so so,6
1396,no means no,1
1397,Enjoyable film! Don't care about the critics. There's definitely some bias against it.,8
1398,It was fine.,7
1399,Caught in a landslide; no escape from banality,4
1400,Need to see joker,6
1401,Bad,2
1402,An Interesting Episode,7
1403,not even as your less expectations,2
1404,Love this movie!,8
1405,DC villains 'Dirty Dozen' out to save our world....,7
1406,a failed attempt,5
1407,Better than the critics let on.,8
1408,Movie Review Profits,6
1409,Narrative mess,1
1410,OK-ish film but I expected more.,6
1411,Trash,1
1412,"Shaky Opening, but Fantastic Character Work",6
1413,Meh...!,5
1414,This is my favorite movie,10
1415,I so wanted to love this movie!,6
1416,Above average Summer Fun Flick,8
1417,No joke!,6
1418,A huge mess.,4
1419,I had fun,6
1420,DIRTY (half) DOZEN....,1
1421,Good action comedy movie if you haven't read the comics,7
1422,"9 for style, 1 for substance, so 5",5
1423,I like it,10
1424,The ingredients are good but the soup isn't,6
1425,Awful,1
1426,What is wrong with the critics??,8
1427,Average movie,6
1428,The movie had nothing to do with what the trailer promised,1
1429,Meh...,6
1430,The worst,5
1431,A Good Villains Movie With Too Much Hate,7
1432,"Sometimes, Critics Just Don't Get It",4
1433,It's a fun movie...stop putting it under a microscope,8
1434,It's not that bad,7
1435,This reminds me why I usually avoid most superhero films...42.5%,4
1436,not disappointed at all !!,8
1437,Still better than Fant4stic lol,6
1438,Complete Trash Movie,1
1439,Keep pace with this swirling storytelling while cool in a theater,7
1440,Terrible...!!!,2
1441,David Ayer cut !!!!!,6
1442,highly disappointing..,3
1443,I liked it!,8
1444,"Flawed, but not terrible",6
1445,Epic waste of time.....,2
1446,Enjoyable,8
1447,"most notably for giving us Margot Robbie's Harley Quinn, but generally ok",6
1448,ridiculous,5
1449,Suicide squad,6
1450,I never care about imdb but...,1
1451,Good enough but not great,6
1452,"Dry and Scripted, TBH",4
1453,"It's what you expect, if you know what to expect",9
1454,Only 2 good things came out of this movie.,6
1455,Another mess from DC/WB,4
1456,Let's Go Save The World!,9
1457,This DC Extended Universe movie is for the kids/teens,6
1458,Utter Crap,1
1459,"Half-baked plot, two dimensional characters, and terrible dialogue",6
1460,"Severely Disappointing - poor structure, story and editing",4
1461,The good & bad of Suicide Squad,6
1462,It could have been SO GOOD,4
1463,Pure Fun,8
1464,"Giving a 7 for you, Ms. Quinn...",7
1465,'Dirty Dozen' cartoon garishly coloured in,5
1466,A Bad Guys Fun Movie,8
1467,Would have worked better as a Sequel...Maybe to a standalone Batman film,6
1468,Complete Disaster,1
1469,review,6
1470,Much less than expected,5
1471,A good film with some problems! Deja vu with a DC film!!!,6
1472,"""Suicide Squad""- Another misfire for the struggling DCEU, though it is not without its moments. Entertaining but woefully messy.",5
1473,Suicide Squad Rocks!,8
1474,Should DC get back the Christopher Nolan???,7
1475,What a mess,2
1476,Great Movie,10
1477,Lots of fun parts but meaningless story-line :(,6
1478,It's just as bad as I remember,2
1479,Spectacular,7
1480,DC hates its directors,4
1481,"A better entry to the DC canon, but the bar is kind of low.",7
1482,Defies expectations more than necessary,5
1483,A highlight in this dull year,9
1484,"Not too bad but come one, there's stuff missing",6
1485,I guess it's not my cup of tea...,5
1486,a beautiful disaster,8
1487,I expected more but it was interesting...,6
1488,Margot Robbie and Will Smith are the only reason to watch,2
1489,"Kind of good, kind of bad",6
1490,bad movie but redeemed by two things,2
1491,"""Oh, I'm not gonna kill you... I'm just gonna hurt you really, really bad.""",6
1492,I expected better.,5
1493,Great Movie!!!,9
1494,Just another one superhero movie,7
1495,A Mess,3
1496,Actually really good,8
1497,Great but badly put together...,7
1498,'Suicide Squad' commits suicide.,3
1499,My review,6
1500,I Can't Believe I Liked This at One Point,1
1501,Pretty good,7
1502,"I was the ""the lucky one""...",4
1503,Never listen to critics before seeing it for yourself,9
1504,Entertaining enough but a missed potential,6
1505,The worst of the worst,3
1506,"Awesome soundtrack, unbelievable acting, intriguing storyline, great cast",8
1507,"I really wanted to love this film, but..8",6
1508,"""all the reviews are bad but I actually really loved it you should see it!""",5
1509,Clich√© hero movie,6
1510,w,2
1511,Good Summer Flick,7
1512,Bad meets Evil? Hell no!,4
1513,Ignore the critics. You won't regret it,8
1514,It is a very heartwarming story,6
1515,I couldn't actually spoil this film :P,3
1516,"Nice movie, Wasted opportunity!",8
1517,Critics need to loosen up: We live in a mad world.,7
1518,Idiotic movie,2
1519,A very good movie...,7
1520,A little fun but with unfortunate script,5
1521,Best Harley Quinn ever!,7
1522,Suicide Dud?,5
1523,"Ignore the critics, make up your own mind.",8
1524,Had a lot of potential!,6
1525,It's undone some of DC's steps forward with The Dark Knight.,4
1526,Very Impressive,8
1527,Quite disappointed,6
1528,Disappointed,2
1529,"Good, not great",7
1530,"Very weak story line, bad acting and corny catchphrases",3
1531,A flawed but fun movie,6
1532,A Bad & Boring Feel-Good Buddy Movie,2
1533,"Entertaining, But Leaves You Wanting More",8
1534,Jared Leto ruins the show.,6
1535,What the hell did I just watched?!,5
1536,Actually a very good comic book movie !,8
1537,Suicide Squad Review,6
1538,Worst DCEU film yet,3
1539,I like it,7
1540,Not that great,5
1541,Disappointed,6
1542,Amateurish waste of talent and money,1
1543,Comedy movie with great action and terrific acting,8
1544,Such Great Potential,7
1545,This movie is sooo bad it's almost unbelievable it got made,1
1546,An all around good summer movie! Go see it!,8
1547,Average at best. Entertaining but problems production wise,6
1548,"First of all, let's stop comparing any DC project to Nolan's trilogy",2
1549,Harley Quinn! Harely Quinn! The only name you need,6
1550,BAD guys or bad lol,1
1551,I tried to like it,6
1552,What a shameful movie,2
1553,Much better than the critics made it out to be...,8
1554,Neither here nor there,6
1555,Just poor effort,3
1556,Exciting,9
1557,Bad is good and good is bad.,7
1558,A Mess,3
1559,disappointed after too much HOPE,6
1560,This film should never have been released.,1
1561,Missed opportunity,7
1562,The worst DCEU movie thanks to studio meddling,2
1563,"If ever a movie stumbled in the delivery of promised greatness, it was surely this one. Unmissable !",8
1564,Is this a joke?,3
1565,Entertaining Film,9
1566,One word.. 'Awful',1
1567,Nothing worse than a boring movie,1
1568,F,3
1569,An unstoppable joyride with the squad,8
1570,"Confusing. Boring. Spoilers, I guess...",2
1571,A Hutch A Do About Nothing,9
1572,A poor studio made movie marginally saved by the glimpses of Ayer's direction and wonderful cast,2
1573,So much potential. So little on delivery,3
1574,The Man That Can Climb ANYTHING,5
1575,Hey! You guys... it's actually a pretty good movie.,9
1576,If 'Spider-man 3' and 'Mulholland drive' had a baby; it would be 'Suicide Squad'.,4
1577,Great movie and characters,9
1578,Incredibly terrible.,1
1579,One of the worst movie of The DC Cinematic Universe,5
1580,Poor,1
1581,Every frame is not meant to be perfect. It's a fun movie.,8
1582,I wonder when the kids are going to tire of the same formula,4
1583,Lots of Fun,9
1584,The DCEU is DOA,1
1585,dedee,1
1586,What did you do?!,1
1587,No way near as bad as others say,8
1588,Complete disappointment!!,3
1589,"Loved it, don't listen to the haters....",9
1590,Avoid at all costs,4
1591,Hugely Disappointing,5
1592,Nothing of value found in this movie.,1
1593,Genuinely don't understand all the bad reviews.,10
1594,A hot mess,4
1595,Doesn't Deserve the Hate,8
1596,Ohh... WHY?,2
1597,Plagiarism,5
1598,Absolutely atrocious,1
1599,Must watch movie. I've seen thousands of movie and this one was good.,9
1600,Suicide watch...,1
1601,take this from someone who knows films,8
1602,A Complete Mess Unfortunately (Contains Spoilers),4
1603,Dc is definitely lost,2
1604,Saved from being terrible by Margot Robbie (and Davis and Smith),4
1605,Nice...,10
1606,Suicide Squad,5
1607,Why all the negative reviews?,9
1608,Suck Squad !,1
1609,Not Worth Your Time,1
1610,Not as i Expected,2
1611,Awesome movie!,10
1612,Hope the new one is better,5
1613,Why not?,10
1614,Biggest Misfire Ever,2
1615,"""Puddin'!""",4
1616,One of the most enjoyable comic book movies in recent years.,4
1617,Awesome movie! more fun than i expected (more than BVS for sure),10
1618,This movie is truly awful,2
1619,Better the second time around,10
1620,Disappointing,3
1621,"For The Good of Mankind, #ReleaseTheAyerCut",3
1622,Erm........,5
1623,perfect,10
1624,Disappointed,5
1625,not bad,10
1626,"Great characters, but terrible plot and everything else is just bad",2
1627,A big money-grubbing middle finger to all comic fans!,2
1628,This movie is dreadful!,3
1629,Its not bad at all!!!!,10
1630,Random,1
1631,Really enjoyable untill you think about it!!,10
1632,This movie is garbage.,3
1633,"A lot of potential, minimal effort.",3
1634,"Goo start, bad ending",5
1635,Great,10
1636,Only for the die-hard DC comic book fans...barely,4
1637,Twizard Rating: 78,8
1638,Unbiased and spoiler-free review,5
1639,Suicidal,2
1640,Total waste of actors and characters.,1
1641,Film made it likable,8
1642,Just Boring,1
1643,Make your own opinion.,8
1644,Trying to do a little too much,5
1645,S.S - Skewered and scrambled,4
1646,I expected much more...,4
1647,I love this movie,8
1648,It could've been better...,4
1649,"Everybody be cool, you be cool...",8
1650,Losing My Faith In DC,5
1651,Directed by The Joker,2
1652,The DC Cinematic Universe has just committed cinematic suicide,4
1653,Not perfect but a good nights viewing,8
1654,Disappointing,3
1655,It Lived Up To The Hype,8
1656,"Way too many characters, too little development",3
1657,"Horrible Scripting, Wasted opportunity with tremendous talent. All stars only for Jared Leto.",5
1658,"Not the best, but Sort of enjoyable...",5
1659,DC The god Of Villains,10
1660,stupid,5
1661,Entertaining and good ... why all the negativity?,9
1662,"Why didn't anyone ask ""why""?",3
1663,'false advertising' over the lack of Joker scenes,5
1664,lame action film,2
1665,"Don't listen to the critics! The movie was fun, and action packed and awesome!",8
1666,"Painful. Horribly inconsistent, and mental anguish.",1
1667,"If you like DC comics and/or superhero movies, go check this one",9
1668,Really bad. Worse than Batman v Superman,1
1669,Is this a suicide concerning creativity? Or a squad beneath acting?,5
1670,most terrible story line ever,2
1671,An amazing movie just what DC needs!,10
1672,Bad as it can get,1
1673,Not perfect but enjoyable and exciting,8
1674,Meh should of been better ...... 5/10 .,5
1675,"A Talented Cast Trapped in a Rushed, Crowded Mess",5
1676,Simply too many characters,4
1677,Critics exaggerated,9
1678,"A Simple Pros & Cons List - No Spoilers - ""What's with DC and Instant Friendships?""",5
1679,"Fun, Fantastic, and Hilarious",10
1680,Hollywood let me down again!!!!!,3
1681,"Suicide Squad: ""Im Beautiful!""",5
1682,"They're the bad guys, and this is a BAD movie.",4
1683,suicide squad,10
1684,Worst movie ever,1
1685,Not a perfect film but absolutely worth the watch.,8
1686,Very little of value in this film,4
1687,Suicide squad sets a new benchmark of how worst a superhero movie can get.,2
1688,Entertaining and cool scenes in a very meh plot,5
1689,worth an IMAX 3D visit,8
1690,High expectations... very disappointed.,4
1691,I Really Don't Get the Hate!,10
1692,How is this man getting paid jobs?,1
1693,Abortion,1
1694,The trailers of the movie were very good though. . .,5
1695,Wtf is wrong with you folks?,9
1696,Such high hopes...,5
1697,A really good movie!,9
1698,My little pony: friendship is magic,4
1699,Not worthy to be called a movie even,1
1700,I Liked the Movie this Could've Been,4
1701,GREAT MOVIE,8
1702,Disappointing for what looked like such a good resurgence for DC,4
1703,DC's Guardians of the Galaxy!,9
1704,"In the case of the title, there should always be a squad like that present when attempting to view this ""film"".",4
1705,I honestly wasn't disappointed.,2
1706,A Guilty Pleasure,4
1707,Great watch,10
1708,"After seeing Suicide Squad this past weekend, I was left disgruntled by the awful choices Warner Brother Studios has made this year with their expansion of the DCEU.",4
1709,Awesome,8
1710,Worst movie ever made,1
1711,Directors Butchering,5
1712,Trash beyond imaginable,1
1713,Another good DC Movie,10
1714,Harley Quinn.,5
1715,Will go down as one of the most underrated films in the history of cinema!,9
1716,Stop using comic books to defend this movie!,3
1717,I won't bet my money on it's success,4
1718,Review for Suicide Squad,4
1719,Loved it!,9
1720,An Avengers style movie with a bit of Deadpool but with bad guys instead,4
1721,Answer to the negative reviews,8
1722,RIP My Money,3
1723,Suicide Squad suffers from Zacification,4
1724,Perfectly bad ensemble movie,2
1725,"Waaaauuuuw, what a ride!",9
1726,"Here Me out, cause I think I make a good point.",3
1727,"Very good, but not excellent",8
1728,Stock up on Advil.,3
1729,Really Disappointing: A David Ayers film?,4
1730,Dc falls flat in comparison to marvel yet again,2
1731,My issue,10
1732,I would put it on as a background movie?òï,4
1733,A really strong & unique follow-up to Batman v Superman: Dawn of Justice.,10
1734,Extremely Hyped Up,5
1735,Sabotage,4
1736,Abysmal. The producers should be ashamed.,2
1737,"Crazy, fun, indulgence. Suicide Squad for many years to come.",10
1738,A mess,4
1739,"Suicide squad is an amazing movie, screw the critics.",9
1740,"Not enough comedy, not enough action, plenty of sappy scenes.",2
1741,Very Messy,4
1742,"Great Start, but Quickly Falls Apart",5
1743,"Didn't Want to See It, Glad I Did.",9
1744,Incoherent and weak plot,5
1745,Excellent!,9
1746,"One Step Forward, Two Steps Back",2
1747,A cheap parody of the DC universe,1
1748,Soundtrack was the best thing about this,3
1749,Thank Squad the DCEU could be saved after all!!!!,9
1750,Go Watch Batman the animated series instead!,5
1751,definitely a movie you'll need to see for yourself to make up your mind,9
1752,"It's Not a Great Movie, but it is the Best from the DC Universe Movies",5
1753,What a disappointment,3
1754,Wow,3
1755,Fun summer movie. If you like Guardians of the Galaxy you will like this.,10
1756,Zero should be an option,1
1757,Will Smith delivers the goods again with Suicide Squad,8
1758,Doesn't live up to the hype,3
1759,An absolutely terrible venture in filmmaking.,4
1760,Yikes! weaksauce...,3
1761,A Magnificent Mess That Is Both Extraordinarily Fun And Entertaining DESPITE Itself..,10
1762,embarrassing!!,4
1763,"In short this movie is a great mix of Comedy, Story and Action.",10
1764,"Suicide Squad was mediocre at best but more-so disappointing because of its potential but, at the same time, it doesn't quite deserve all the hate it is getting.",4
1765,Sound and Fury. Signifying nothing.,3
1766,Talented Cast makes a poor script worth the watch.,5
1767,This movie is awesome,10
1768,So and so bad,1
1769,"Great Plot, great Soundtrack, great acting, great movie.",10
1770,They made drag queen out of Joker,4
1771,Mediocre,3
1772,Suicide Squad: A Fable about Shared Universes and Studio Interference,3
1773,The Anti Avengers,8
1774,It could've been better,5
1775,Very happy with the movie overall :),10
1776,A disgrace to the whole DC universe.,1
1777,"Doesn't deserve the over hate, or the over love",2
1778,It's just a mess,4
1779,Don't listen to the pretentious critics,10
1780,"Wow, that was awful",2
1781,It's all about entertainment and fun,10
1782,city goes boom.,3
1783,Senseless fun & entertainment with all of its rebellious action sequences.,4
1784,Worst. Heroes. Ever. more like Worst. Movie. Ever. (not really),1
1785,Welcome to the Suicide Squad complete the mission or die trying.,10
1786,Puerile and trashy intent but no redemption in the execution,2
1787,Haters gonna hate,8
1788,bad acting and so stupid that style can't save it.,4
1789,Absolutely terrible,1
1790,Dc comics's (1) worst movies of all time,1
1791,a year of waiting well worth,10
1792,Worse than I thought!,5
1793,"Worst Heroes Ever? No, Entertainingly FUN!!....",10
1794,Good fighting scenes won't make up for bad story,4
1795,Really Poor,3
1796,Just nothing that the trailer promised,3
1797,Awesome movie. I hope there is a sequel and spinoffs.,10
1798,Could have been Amazing. Too many bad choices.,4
1799,"Visually stunning, Don't believe the critics , Fun summer blockbuster",10
1800,"For a movie written by a 10 years old child, it's not bad",3
1801,It's a mess!,4
1802,"Too dark, too much, too many",4
1803,"This is Harley Quinn's Movie, and I Couldn't Be Happier!",8
1804,Over-Hyped Disappointment is an Understatement,3
1805,Loved every second of it!!!,10
1806,What a bad movie.,3
1807,Not Like This,2
1808,Truly Horrible,1
1809,The critics can go to hell,10
1810,"The final DC movie I will ever pay to see, even if it was OK in the end.",2
1811,Best,10
1812,This movie was the worst,3
1813,"Making an edgy movie isn't the same as making a GOOD movie, I mean my razor is edgy and its a cheap piece of sh*t",3
1814,A Worthy Rival to Catwoman,4
1815,A group of unlikely comic characters save the world,10
1816,Gave Up Half Way Through,2
1817,I¬¥m a Joker,10
1818,"1 point for Will, 1 point for Jared, 1 point for the music, and 1 point for Margot = 4",4
1819,Her Heart's Not In It,2
1820,Condition Critical: DC,1
1821,Honest Review from a Comic book fan,10
1822,It's simply the worst nanananaaaaaaaaaaaa,1
1823,Insainly Entertaining .. Love the twist,10
1824,A jumbled mess with a good cast,4
1825,Incoherent and sexist,2
1826,"Lot of style, but no substance.",5
1827,Awesome!!!!,10
1828,Sits somewhere between good and really bad,5
1829,Awesome movie don't listen to critics,10
1830,It's so terrible and female-pandering even the director admits he should've focused on the Joker,1
1831,Not as good as the first one,5
1832,All over the place in terms of...Everything,4
1833,Margot Robbie Steals the Show,8
1834,It's not what i expect at all,4
1835,Suicides,8
1836,Bad Movie Review on Suicide Squad,2
1837,DC turned into Marvel,5
1838,You think Batman v Superman sucked???,4
1839,DC takes a step forward,10
1840,Not as expected.,5
1841,BEST MOVIE EVER!!,10
1842,Committing Career and Box office Suicide (Squad),4
1843,"Worst ""superhero"" movie ever!",3
1844,Almost fell asleep,3
1845,What is with the bad reviews people,10
1846,I want my money back.,4
1847,AWESOME,10
1848,What did I just watch?,2
1849,not a good plot,4
1850,Disappointing,3
1851,One Of The Best Movie Ever,10
1852,Not what you think,3
1853,A good movie,10
1854,Looks great but,5
1855,This is not Suicide Squad.,1
1856,Would like to change my review,1
1857,Anticipation was not in vain,10
1858,Disappointing and Boring!,4
1859,This is awesome!,10
1860,One of the few movies i've seen in my life that actually made me angry,2
1861,Unhappily,5
