,review,rating
1868,"Margot Robbie, perfect; not so much Leto.",0
1869,Movie should have had a different TITLE,1
1870,Horrible,0
1871,Give us a Sequel! PLEASE!,1
1872,"2 films, very different outcomes.",0
1873,A suicide indeed,0
1874,Harley Quinn's Love Story,0
1875,Amazing! Must See!,1
1876,Boring,0
1877,Good Movie,1
1878,Too Jewwy,0
1879,Very Bad,0
1880,Suicidal tedium.....,0
1881,Never see ROTTEN TAMATOES ratings for DC FILMS,1
1882,Irritating waste of money,0
1883,Better than BvS,1
1884,Dont waste your time,0
1885,Maybe the worst film of 2016,0
1886,boring,0
1887,Master Peice,1
1888,Everyone cosplayed as characters from this movie on halloween back then...god...why ?,0
1889,Absolutely Loved It,1
1890,Just...not good,0
1891,Nothing new - not even current.,0
1892,Suicide Squad? Wait none of them did that...,0
1893,GOD-TEAR MOVIE,1
1894,A huge disappointment !,0
1895,Suicide Squad,1
1896,Rushed work spoils potential,0
1897,This movie is... OK.,0
1898,"Amazing acting, fascinating back story, and tragically bloated",0
1899,Harley Quinn,1
1900,Wow.,0
1901,Worth seeing more than once!,1
1902,A typical case of the trailer being better than the movie. Period.,0
1903,Trash,0
1904,Not as bad as most people may realize!!!,0
1905,REALLY FANTASTIC!!,1
1906,A lot of hype but not much,0
1907,one of the best comic book movies,1
1908,5,0
1909,"It Has Some Fun Moments and Some Solid Performances, but It's Still a Pretty Weak Movie Overall",0
1910,Definitely not as bad as critics say or is it?,0
1911,Absolutely Unique!!,1
1912,Worst of the worst,0
1913,The critics are the ones who haven't watched the movie.,1
1914,"Enjoyable, but not as expected",0
1915,It's bad,0
1916,"Avoid it if you can. I couldn't, unfortunately...",0
1917,A Love Story?,1
1918,cringe,0
1919,The best movie in 2016,1
1920,Zero If I could. Worse than B V S,0
1921,"I liked it, but...",0
1922,One of the worst superhero movies,0
1923,Funtastic good time!,1
1924,"Level of Dark Knight or the Avengers, but somehow people don't like it as much",0
1925,"Give the DCEU to David Ayer, this is how you make a DC movie!",1
1926,Disappointing,0
1927,"There are good bad movies, then there is suicide squad.",0
1928,Highly disappointing,0
1929,Full underrated,1
1930,Little more than a jumbled mess,0
1931,Great film,1
1932,suicide squad is right!,0
1933,"Slow, Disjointed yet Well-Acted",0
1934,Wow! New and unimaginable levels of awfulness,0
1935,Dnt go for rating its masterpiece,1
1936,Stupid movie,0
1937,An amazing movie,1
1938,"Screw Happy Feet, This is the true worst movie of all time",0
1939,No story just awful action scenes!,0
1940,Not what I expected,0
1941,One of the Best DC - Movies,1
1942,A promising looking title that did not live up to its expectations,0
1943,Excellent Movie,1
1944,Try hard mess of a film.,0
1945,"they didn't fix the problems, just added to them",0
1946,"Huge disappointment, way to corny",0
1947,AMAZING!!!!!,1
1948,I R8 4 out of 10,0
1949,absolutely adored it- new favorite movie!,1
1950,A Movie and Its Trailers (Maybe One Spoiler),0
1951,Another DC Disappointment,0
1952,Reminder: pathetic <> funny,0
1953,Top of the Line,1
1954,It was ok,0
1955,My third favorite movie of all time,1
1956,Could of been better !!,0
1957,"Matin√©e worthy, not date worthy",0
1958,Worst comic book movie I've ever seen,0
1959,THE BEST MARVEL MOVIE I'VE EVER WATCHED,1
1960,Suicide Squad v. Gozer the Gozarian,0
1961,Suicide Squad: Best Love Story since Titantic...,1
1962,How I committed Suicide on Friendship Day,0
1963,Wastage of good potential!!!,0
1964,really is Hollywood joking???,0
1965,This movie was great,1
1966,A missed opportunity,0
1967,Suicide squad,1
1968,This is what happens when you let the garbage can spill over,0
1969,Bad movie with a lot left to be desired,0
1970,Lucky I didn't watch it in the Cinema,0
1971,Nice surprise,1
1972,"""The Dirty Dozen"" meets ""The Mummy"" ...",0
1973,Jared shines,1
1974,Very boring movie,0
1975,Seen Avengers?,0
1976,The Ho-hum Squad,0
1977,A Female Perspective of what could have been a bromance movie,1
1978,Not a good movie,0
1979,Fun and enjoyable,1
1980,"Supernatural threat is destroying the entire world, better send a psychiatrist with a baseball bat",0
1981,Cheerful bad guys,0
1982,jared letto was the best,0
1983,SUICIDE SQUAD,1
1984,The Worst Parody of Itself !,0
1985,infertility issues,1
1986,"Fun movie, but bad plot.",0
1987,pooicide squad,0
1988,Studio meddling and weak script undermine potentially great movie,0
1989,An excellent take by WB and DC on DC's most vicious villains!,1
1990,Boring.,0
1991,Joker's girlfriend rocks,1
1992,The worst acting,0
1993,A dumpster fire,0
1994,Bad in all aspects,0
1995,"Far better that the ""sequel""",1
1996,Suicide Script,0
1997,Better than I thought,1
1998,This film just felt like a chore to watch.,0
1999,"Not bad, not great.",0
2000,I saw it on release,0
2001,"Cool movie, I liked it. Trlica they pereborshil with special effects especially at the end. And the Joker would like much more.",1
2002,Was it worth the hype?,0
2003,What were you all expecting?,1
2004,Stupid Squash,0
2005,Big budget Big stars BIG FAIL,0
2006,Several misdemeanors.,0
2007,The best movie ever,1
2008,Wasted potential,0
2009,Is it Possible NOT to fall for Margot Robbie?,1
2010,Just above Halle Berry's Catwoman,0
2011,There is no story line,0
2012,Absolutely terrible,0
2013,This is exactly what the DCEU needs right now.,1
2014,An iconic worst film of all time,0
2015,Um so...,1
2016,"Cool, but not good",0
2017,What The Hell Happened,0
2018,It could've been awesome,0
2019,Suicide Squad is a hot mess.,0
2020,A world of blurred lines,1
2021,Just another typical action film...,0
2022,This is an unfocused mess,0
2023,uah,0
2024,Better Film Than Most Want To Believe,1
2025,Suicidal Silliness... Stop spewing such swill,0
2026,"Bad Guys, Yes. Bad Movie, No Way!",1
2027,The worst superhero movie ever,0
2028,"It's, just alright",0
2029,Dissapointed dosent come close,0
2030,What's wrong with people!!!,1
2031,The first DC Universe film to hit mediocre.,0
2032,Great Movie!!,1
2033,Bad,0
2034,Worst from dc,0
2035,All hail Margot Robbie,0
2036,Best movie!,1
2037,Yeah...not good.,0
2038,"Upon Rewatching it years down the line, It's One of DC'S Greatest ever made ?íô?íö?íì?íõ?íú",1
2039,Mind numbing,0
2040,Cheap show,0
2041,I am simply baffled,0
2042,Its Difficult to dislike this movie,1
2043,Phantasm music rip off?,0
2044,Such a good film,1
2045,How to ruin Batman villains.,0
2046,What happened to D.C Movies?!,0
2047,Esquadr√£o Suicida,0
2048,Likeable,1
2049,Crook,0
2050,"A really good and enjoyable movie that would better with a little bit jokes less, not the best movie of all time but still very good.",1
2051,The most ridiculous movie ever?,0
2052,Plot? What plot?,0
2053,Opts for mainstream when it should be punk rock,0
2054,The super villains are just handed with government weapons to take out an enemy that normal officers could not handle,1
2055,is ma E L good night phantom en French too pour mademoiselle Thylene Blondeu,0
2056,It's better than your average super hero movie,1
2057,"Don't forget, we're the bad guys.",0
2058,Harley Quinn was fun....the rest not so much,0
2059,"It's not bad, it's horrible for sure !!!",0
2060,"A great fun filled, comic accurate movie fun for the family (older kids)",1
2061,"It just crap like, really crap",0
2062,Awesome!,1
2063,Could have been much better,0
2064,"A suicide, indeed",0
2065,Worst Hero-movie in years,0
2066,DC Presented The Story Wrongfully...,1
2067,"Fun movie. Not perfect, but fun.",0
2068,This story pretty much is the gathering of villains in order to fight a bigger villain. It goes into a bit of each villain's origin story.,1
2069,Suicide squad : Hit and miss,0
2070,"A Chaotic Catastrophe, But Harley is Hot.",0
2071,Was a load of absolute rubbish,0
2072,"Great Acting, Bad Plot...",1
2073,Waste of time,0
2074,Enjoyed,1
2075,"Jared Leto plays awful Joker, awful jokes, Marvel copycat movie",0
2076,Not worth It,0
2077,Don't believe the hype,0
2078,Tentamen Suicidii*,1
2079,Top 5 worst movies I've ever seen,0
2080,Margott Robbie is star of this movie,1
2081,Juggling 10 balls and catches 5,0
2082,Very disappointed,0
2083,Sometimes glory has to rise from the ashes.,0
2084,Evil villains unite,1
2085,What if time.,0
2086,I keep coming back,1
2087,Harley Quinn saves the day,0
2088,So much so promise and so little delivered,0
2089,A fun adventure!,0
2090,Possibly the Most Average Film EVER!,0
2091,could this be any better,1
2092,awful edit and direction,0
2093,Not much.,0
2094,This movie is exploitation,0
2095,Sucide Squad was very funny and entertaining,1
2096,Good but not great,0
2097,some people are too hard on movies,1
2098,"Yes, it is as bad as everyone says",0
2099,Disgustingly stupid superhero movie,0
2100,Makes you wish that everybody died so there'd be no sequels or spinoffs,0
2101,Horrible edit but some intense and compelling performances,1
2102,Good action. Poorly written,0
2103,A refreshing adaptation from comics to cinema.,1
2104,Better than Expected,0
2105,Lacked Importance,0
2106,Boringggg,0
2107,I liked it. Unfortunately in IMDB there are a lot of trolls.,1
2108,Not as bad as you think.,0
2109,Suicide Squad 3 or for in the next generation of AI technology,1
2110,Quick summary,0
2111,Margot Robbie saved the film,0
2112,Unbelievably disappointing,0
2113,Some fun characters surrounded by bad CG,1
2114,Another conflicting movie by DC,0
2115,Fun movie,1
2116,actors were good..but plot was just sad,0
2117,Overhyped mess,0
2118,Sheer waste of boundless talent,0
2119,Suicide Squad Review,1
2120,Entertaining film. Decent quick backstory on the characters. Not the best story or acting.,0
2121,Awesome..!,1
2122,Over-hyped and disappointing mess,0
2123,Terrible representation of the characters and the plot was way out of my comfort zone,0
2124,Misses a lot of key aspects,0
2125,"A mix of the good, the bad and the awesome.",1
2126,Average film,0
2127,One of only 2 movies you should watch this Summer!,1
2128,What a terrible movie!!!!,0
2129,A beautiful disaster...,0
2130,Mediocre,0
2131,Review,1
2132,margot robbie literally carrying the movie all by herself,0
2133,A new DC Masterpiece...,1
2134,Achoo! (The release of this movie in a nutshell) NOT YET FINISHED,0
2135,"While there were elements that I liked, I disliked the overall film.",0
2136,Not satisfied,0
2137,Suicide Squad is an UNCONVENTIONAL DC Universe film,1
2138,"They are not superheroes, they are supervillains.",0
2139,A satisfying popcorn film with several strong performances,1
2140,In summary,0
2141,Bad,0
2142,Not Deadpool,0
2143,Very good continuation,1
2144,"Well, its more fun than anything else in the DCEU",0
2145,It was extremely enjoyable,1
2146,Ok movie that was jacked up just to get PG13,0
2147,"The potential was big, the waste of it was even bigger",0
2148,Simply Awful,0
2149,Terrific movie.,1
2150,Another example of a terrible DC movie,0
2151,Don't get the bad reviews I loved it,1
2152,1,0
2153,Not that fun or enjoyable to watch.,0
2154,Worse than expected,0
2155,Harley Qu...Suicide Squad,1
2156,I disliked it so much I actually signed up for an account to give it 2*,0
2157,It's a Fun DC movie,1
2158,"Dull yet random, cheesy, predictable",0
2159,So angry I got off my lazy arse and was compelled to write,0
2160,Failure,0
2161,Comics are not (allways) for kids,1
2162,It's a great movie to it see,0
2163,Suicide Squad,1
2164,Not my cup of tea....,0
2165,Patriotic Crap,0
2166,Good grief,0
2167,Do you have questions? lemme answer em,1
2168,Wacky but a little bit tame,0
2169,Offbeat story with entrancing performance.(Spoiler free review),1
2170,It's Just Okay.,0
2171,Will DC ever learn?!,0
2172,Rating: C+,0
2173,"fun with delicious characters, lots of fighting and stuff on fire",1
2174,"Right in the middle, no compromise.",0
2175,Much better than all other comic book movies. Feels genuine rather than having childish jokes,1
2176,An Average Superhero Movie,0
2177,Fan service galore,0
2178,It's Alright...,0
2179,SO COOL!!!!,1
2180,I am so bad,0
2181,Why So Serious?,1
2182,Harley Quinn deserves a better film,0
2183,It was ok,0
2184,killed joker,0
2185,"A Fun movie, tortured by the hands of critics",1
2186,I had high hopes...,0
2187,Joker is the best,1
2188,Lame movie,0
2189,Even white trash needs super heroes they can identify with,0
2190,Fell Flat,0
2191,Great movie don't understand the hate,1
2192,"Decent, but messy",0
2193,8/10---The 2nd Most Underrated DC Movie,1
2194,i regret watching this,0
2195,Great acting. Bad...editing?,0
2196,Underrated,0
2197,my opinion,1
2198,Marvel movies have become formulaic. Here is DC working out its own formula.,0
2199,The hate is confusing,1
2200,"decent follow-up Joker to Ledger's, otherwise ""ugh""",0
2201,I don't know whether to blame the writers or the director,0
2202,"Overall, a disappointment, but I remain optimistic about the future of the DCEU",0
2203,Harley Quinn,1
2204,Suicide Squad,0
2205,My opinion,1
2206,What did i just watch ?!,0
2207,The Vidiot Reviews...,0
2208,a fun time at certain times,0
2209,A fun movie with more problems then usual movies.,1
2210,Average,0
2211,"Too Much Chaos, Too Little Plot",1
2212,Begins well but then becomes unintersting mess,0
2213,I dozed off,0
2214,Movies I've also rated a 2 are.....,0
2215,Y'all hate a movie because it doesn't please you so selfish,1
2216,Suicide Squad brutto film,0
2217,Loved it.,1
2218,Two words. Atrocious and Horrible,0
2219,Originally saw it in theater...,0
2220,Not that memorable,0
2221,Awesome,1
2222,What A Bunch of Softies!,0
2223,Awesome! Plot is lacking though.,1
2224,Man....,0
2225,"A good soundtrack, but not much else",0
2226,Kiss ass - DC style,0
2227,Great,1
2228,Suicide Squad (2016),0
2229,Insanity,1
2230,"Not a bad movie, but it ain't a good one either.",0
2231,I can't find anything to like in this movie,0
2232,To rushed,1
2233,One of the worst blockbuster movies i have ever experienced.,0
2234,It's way better than what you heard,1
2235,A waste of time,0
2236,Harley Quinn. Nice to Meet Ya.,0
2237,"One mess of a movie, but it's somewhat entertaining.",0
2238,Watched director's cut and was amazed!,1
2239,Arrow ripoff,0
2240,Leto and Robbie/Joker and Harley,1
2241,Wtf,0
2242,Disappointing,0
2243,Disappointing,0
2244,Suicide Squad creates characters I want to see again.,1
2245,"The worst superhero movie of the year, too disappointing.",0
2246,I blame HBO,1
2247,It's like eating a good pizza that leaves this weird stench in your mouth,0
2248,"When compared to the trailers, it's disappointing. When compared to other superhero films, it's average.",0
2249,DC need to slow the hell down,0
2250,A one time watch which should/could have been a classic for the genre.,1
2251,What i just watch?,0
2252,I loved Suicide Squad,1
2253,Overhyped mediocre garbage.,0
2254,It's Okay,0
2255,A Real Drag,0
2256,"It's not perfect, but it's a step in the right direction for DC",1
2257,Worst Moneymaker ever?!,0
2258,"More fun than GoftheG, no raccoon, better; Margot Robbie",1
2259,Not as bad as I thought it would be,0
2260,yes,0
2261,Really long movie trailer,0
2262,Great movie!!!!! Please watch it,1
2263,I like suicide squad but I think Jared leto/ joker,0
2264,Not really sure about all the hate...,1
2265,There's bad .. and then there's this ... DC Can't seem to get it right.,0
2266,If your 9 years old you're going to love this,0
2267,"Well, the movie isn't as bad as what some critics make it out to be....",0
2268,Good makeup and Margot Robbie's performance brings life into this mess,1
2269,A disappointment,0
2270,general review,1
2271,Just another average movie,0
2272,It's wrong but in the wrong ways,0
2273,Don't waste your time.,0
2274,d,1
2275,The only villain in here is the movie itself,0
2276,The worst heroes ever,1
2277,Very sloppy,0
2278,Confusing and horrible screening (Possible spoilers),0
2279,its entertaining,1
2280,"Lame plot, boring action",0
2281,It's a fun ride,1
2282,Darvel MC,0
2283,"Bad writing/script, as usual from D.Ayer film",0
2284,Worst then green lantern,0
2285,Amazing,1
2286,a complete disconnect,0
2287,"Messy On The Outside, But Inside Is Full of Surprises",1
2288,A disgrace to the Superhero genre and DC Comics,0
2289,Bad casting,0
2290,total garbage,0
2291,"You be the Judge, but I loved the movie.",1
2292,Depends on what you're watching the movie for...,0
2293,"Great movie, must watch.",1
2294,A shame for both Super hero movies and general cinema,0
2295,Long Version,0
2296,Another bad Dc movie.,0
2297,giving a redemption a shot it would be an honor among thieves till suicide do us part lets go crazy for the witch,1
2298,A soul nearly condemned to death.,0
2299,Love,1
2300,A bit of trickery and a lot of lights,0
2301,I Was In A Viola Davis Mood.,0
2302,Wasted potential,0
2303,The Worst Heroes Ever turn the DCEU upwards in this joyful romp.,1
2304,"An enjoyable, but incomplete mixed bag",0
2305,"Good film, what's all the negativity about?",1
2306,Eck...what can I say,0
2307,"..looks and sounds good, with great characters... but story and plot need A LOT of work!",0
2308,The Movie is not as good as the name sounds,0
2309,Deadshot,1
2310,What a mess.,0
2311,Muy Buena La Pelicula,1
2312,No match in comparison to any other super villain movie,0
2313,"The Bad, Good, Guys of Suicide Squad",0
2314,Never been so disappointed in my entire life,0
2315,DC Mayhem,1
2316,I've seen worse,0
2317,Visually Unforgettable With A Big Heart,1
2318,The other color of Zack Snyder producing,0
2319,"Fun and Flashy, Not Quite Enough...",0
2320,Suicide Squad: Be Your Own Critic,1
2321,Abomination,0
2322,(The Sequel Slasher) CRIMINALLY Underrated,1
2323,would give it a 0 if that was allowed,0
2324,It's Meh,0
2325,"ooooooohhhhhhh, boooooooyyyyy",0
2326,Funny and Awesome. !!,1
2327,A Suicidal Name,0
2328,Slow blast.,1
2329,It is not well executed,0
2330,HA HA HA,0
2331,"A-Waller-Waller-Waller-Ho Tell me more, tell me more.",0
2332,Surprise,1
2333,DC fails of trying of doing the marvel formula instead of doing a great villains movie,0
2334,A very entertaining movie.,1
2335,"What a miss, what a miss..",0
2336,Disappointing,0
2337,"With so much potential, great characters and actors surely this was a certain win? Sadly no, the writers, producers and director manage to balls it up",0
2338,Bad reviews for good movie,1
2339,Task Force X,0
2340,The clown girl feel handsome,1
2341,Truly One Of The Worst Films of 2016.,0
2342,Suicide Mess.,0
2343,a great concept destroyed,0
2344,MOST BADASS MOVIE OF ALL TIME,1
2345,DC Extended Universe Marathon 2019 #3,0
2346,"Amazing, original, different.",1
2347,Deadshot and gang shoot what is another misfire for the DCEU.,0
2348,Wtf DC this is,0
2349,disappointing plot less movie,0
2350,Not an Oscar winner but who expects that!?,1
2351,Sloppy editing but not a bad film like the critics are saying.,0
2352,Reminds me of greg,1
2353,Margot Robbie steels the show,0
2354,"awful, just awful.",0
2355,A big pile of disappointment..,0
2356,Loved it!!!,1
2357,"Funny jokes, bad plot",0
2358,The PG-13 rating ruined what could have been the most entertaining Super-hero movie of the year,1
2359,Waste of time,0
2360,Film Review: Suicide Squad,0
2361,Not the DeadPool/Guardians Response DC Hoped For,0
2362,"Suicide Squad: contagious, phenomenal, shocking, worth seeing",1
2363,I'm sorry but...,0
2364,Highly amusing,1
2365,Don't watch it,0
2366,It's good and disappointing at the same time!,0
2367,The best thing about this movie is probably a product placement by Samsung,0
2368,Not sure what the critics were smoking,1
2369,i agree with a little bit (much) disappointed.,0
2370,2 hours of Fun,1
2371,Power Rangers May Have Competition,0
2372,Enjoyable but has some notable flaws.,0
2373,"""All hat, no cattle""",0
2374,Pretty Amazingly Cool But Not Diggin The Joker,1
2375,If you've read the comics stay away.,0
2376,"This movie is not at all bad for those whom rated it based on there thoughts but it really is a good movie, give it a chance.",1
2377,Just a collection of one-liners.,0
2378,"good choice of actors , bad plot , AND WHERE DID JOKER GO?",0
2379,DC at its worst,0
2380,"Not nearly as bad as the critics said it was, better the BVS. A good movie but lacks some edge",1
2381,Trailer made it look good,0
2382,Watch the extended version,1
2383,Not sure yet..,0
2384,Entertaining but misses out on the last stretch.,0
2385,This movie truly made me want to commit suicide,0
2386,"The Characters are great, but the story and damn director..",1
2387,My expectations for this movie were very high,0
2388,Thrilling action DC blockbuster,1
2389,Why does DC like night so much,0
2390,"Perfect title, bad movie",0
2391,Entertaining but disappointing.,0
2392,Great Bad Guy Film,1
2393,Pointless story,0
2394,Roller Coaster!,1
2395,"""The Dirty Dozen"" meets the DC Universe",0
2396,Disappointed!!,0
2397,Worst Super Villain did the worst job.,0
2398,Disappointment Squad,0
2399,So Unimpressive,0
2400,Good Movie,0
2401,Can't Exceed the Ranks of Hopelessly Average,0
2402,Mediocre,0
2403,Extended Version,0
2404,Too Short and Way Too Long at Once,0
2405,Just make a Batman movie with Joker & Harley!,0
2406,"They're the bad guys. Well, kind of bad",0
2407,Bad,0
2408,Kinda good,0
2409,Only watch for Harley Quinn,0
2410,review,0
2411,A joke that never pays off.,0
2412,how can I unsee this?,0
2413,A mess that doesnt match Batman universe,0
2414,How to kill a franchise 101,0
2415,So bad,0
2416,The Most Disappointing Film of 2016 I've Seen So Far,0
2417,Cut to shreds,0
2418,Predictable...,0
2419,A great cast of characters who are unfortunately stuck in a disappointingly mediocre film.,0
2420,Could have been good.,0
2421,What A Disappointment ...,0
2422,People worried about the joker? fear not...,0
2423,Could've been WAY better.,0
2424,An entertaining flick with its share of hiccups.,0
2425,A disappointment,0
2426,This movie is a big terrible mess,0
2427,Total disappointment,0
2428,more than a missed opportunity,0
2429,"A movie that squandered so much potential despite an abundance of source material, a multitude of great characters to play with and a brilliant cast at its disposal.",0
2430,Two Words: Not Impressed,0
2431,Why Do They Keep Dropping The Ball?,0
2432,"Better than people say, could have been amazing, but still disappointing. Spoilers within.",0
2433,Never been that cheated.,0
2434,So disappointed. What a waste.,0
2435,I forgot - all that glitters is not gold ....,0
2436,Blu-Ray Review,0
2437,Flashy but that's mostly it,0
2438,It didn't annoy me,0
2439,Unfortunate disappointment.,0
2440,The Very Definition of a Bad Movie,0
2441,Ughhhh!,0
2442,5 stars because was boring.,0
2443,"Trying too much, accomplishing too little",0
2444,not like in the trailer,0
2445,No point,0
2446,This adio visual produckt is not a movie,0
2447,This movie is horrible,0
2448,Promsing start that fizzled out midway,0
2449,at least i stayed with it and gave it a chance to entertain...,0
2450,How to single-handedly ruin a major studio blockbuster through corporate power (aka Suicide Squad),0
2451,"Movies making money is easy, movies that are worth spending the money to see is a lot harder",0
2452,This movie had great moments,0
2453,5 go mad in Dorset has more bite than this,0
2454,"A Movie that is Not Very Memorable, but Still Leaves Me Excited for a Possible Sequel",0
2455,it's a movie,0
2456,Harley Quinn Saves the Day,0
2457,I want to suicide,0
2458,"great cast and surprisingly fun, but generic and formulaic at best... ruined by studio meddling",0
2459,Mediocre at Best,0
2460,That was gangster no Joking it wasn't great,0
2461,Robbed of my time,0
2462,Horse baloney,0
2463,Worse editing I've seen in a movie,0
2464,I don't usually write reviews...,0
2465,A a missed opportunity,0
2466,Absolute Nonsense from start to finish,0
2467,VIEWS ON FILM review of Suicide Squad,0
2468,A Super Lazy and Truly Awful Film,0
2469,Stunning Visuals Cannot Atone for Lackluster Storyline and Plot Holes Galore,0
2470,"I shouted, ""This is lame"" at the theaters during the movie",0
